### ISSUE TITLE
ACME no cert for MAILCOW_HOSTNAME

### ISSUE THREAD

**Issue by imp1sh** [mailcow/mailcow-dockerized#653]
When I do a fresh install on CentOS 7.4.1708 and set a hostname in mailcow.conf I don't get a valid certificate from Letsencrypt.
Commit: 533f947074c1847494b8d7c7e328968e9158ab5a
Kernel: 3.10.0-693.2.2.el7.x86_64

The following path is just empty:
/data/web/.well-known/acme-challenge
Log:
```
acme-mailcow_1       | Found A record for my.host.name: 1.2.3.4
acme-mailcow_1       | Confirmed A record my.host.name
acme-mailcow_1       | acme-client: /var/lib/acme/acme/private/account.key: account key exists (not creating)
acme-mailcow_1       | acme-client: /var/lib/acme/acme/private/privkey.pem: domain key exists (not creating)
acme-mailcow_1       | acme-client: https://acme-v01.api.letsencrypt.org/directory: directories
acme-mailcow_1       | acme-client: acme-v01.api.letsencrypt.org: DNS: 104.94.46.218
acme-mailcow_1       | acme-client: acme-v01.api.letsencrypt.org: DNS: 2a02:26f0:ce:194::3d5
acme-mailcow_1       | acme-client: acme-v01.api.letsencrypt.org: DNS: 2a02:26f0:ce:19a::3d5
acme-mailcow_1       | acme-client: https://acme-v01.api.letsencrypt.org/acme/new-authz: req-auth: my.host.name
acme-mailcow_1       | acme-client: /var/www/acme/AbSWFt4Hax0psynKbKvCFbvRLi4hqo162YFJg4MnZ88: created
acme-mailcow_1       | acme-client: https://acme-v01.api.letsencrypt.org/acme/challenge/g6AYZzuTiwYSkvUfseVdgKnfsVGLWyZWftxtC5kGd4k/2134146543: challenge
acme-mailcow_1       | acme-client: https://acme-v01.api.letsencrypt.org/acme/challenge/g6AYZzuTiwYSkvUfseVdgKnfsVGLWyZWftxtC5kGd4k/2134146543: status
acme-mailcow_1       | acme-client: https://acme-v01.api.letsencrypt.org/acme/challenge/g6AYZzuTiwYSkvUfseVdgKnfsVGLWyZWftxtC5kGd4k/2134146543: bad response
acme-mailcow_1       | acme-client: transfer buffer: [{ "type": "http-01", "status": "invalid", "error": { "type": "urn:acme:error:connection", "detail": "Fetching http://my.host.name/.well-known/acme-challenge/AbSWFt4Hax0psynKbKvCFbvRLi4hqo162YFJg4MnZ88: Timeout", "status": 400 }, "uri": "https://acme-v01.api.letsencrypt.org/acme/challenge/g6AYZzuTiwYSkvUfseVdgKnfsVGLWyZWftxtC5kGd4k/2134146543", "token": "AbSWFt4Hax0psynKbKvCFbvRLi4hqo162YFJg4MnZ88", "keyAuthorization": "AbSWFt4Hax0psynKbKvCFbvRLi4hqo162YFJg4MnZ88.HRXdz50LvnF2qgH4KqPDNMRxas3urHZiiVv0npVj5DA", "validationRecord": [ { "url": "http://my.host.name/.well-known/acme-challenge/AbSWFt4Hax0psynKbKvCFbvRLi4hqo162YFJg4MnZ88", "hostname": "my.host.name", "port": "80", "addressesResolved": [ "1.2.3.4", "2a00:1:2:3::4" ], "addressUsed": "2a00:1:2:3::4", "addressesTried": [] } ] }] (937 bytes)
acme-mailcow_1       | acme-client: bad exit: netproc(55): 1
acme-mailcow_1       | Verified hashes.
acme-mailcow_1       | Retrying in 30 minutes...
```

When I visit the website I get presented a certificate:
Common Name: mail.example.org
Organisation: mailcow

**Comment by andryyy** [comment]
That's the default snake-oil cert.
The acme-challenge folder is supposed to be empty. There'll be are files for the time of the request.

Is port 80 open?

**Comment by imp1sh** [comment]
Port 80 is open on both IPv4 and IPv6.

**Comment by andryyy** [comment]
Hm, well, it ran into a timeout. Can you mail me the URL to info@servercow.de?

**Comment by imp1sh** [comment]
It seems to be a general IPv6 issue with CentOS.
After disabling rp_filter and reordering the rules (https://github.com/robbertkl/docker-ipv6nat/issues/11) I discovered that incoming connections do get through to the container. The container actually answers but the answer does not get to the outgoing interface (eth0).
```
tcpdump -i any -n -nn port 80 and ip6
10:10:50.599710 IP6 2a00:1:2:3::4.57029 > 2a00:a:b:c::d.80: Flags [S], seq 4040442395, win 1024, options [mss 1460], length 0
10:10:50.599872 IP6 2a00:1:2:3::4.57029 > fd4d:6169:6c63:6f77::a.80: Flags [S], seq 4040442395, win 1024, options [mss 1460], length 0
10:10:50.599886 IP6 2a00:1:2:3::4.57029 > fd4d:6169:6c63:6f77::a.80: Flags [S], seq 4040442395, win 1024, options [mss 1460], length 0
10:10:50.599970 IP6 fd4d:6169:6c63:6f77::a.80 > 2a00:1:2:3::4.57029: Flags [S.], seq 1332124430, ack 4040442396, win 28800, options [mss 1440], length 0
10:10:50.599985 IP6 fd4d:6169:6c63:6f77::a.80 > 2a00:1:2:3::4.57029: Flags [S.], seq 1332124430, ack 4040442396, win 28800, options [mss 1440], length 0
```
```
ip6tables -S
-A FORWARD -j DOCKER-ISOLATION
-A FORWARD -m conntrack --ctstate RELATED,ESTABLISHED -j ACCEPT
-A FORWARD -i lo -j ACCEPT
-A FORWARD -j FORWARD_direct
-A FORWARD -j FORWARD_IN_ZONES_SOURCE
-A FORWARD -j FORWARD_IN_ZONES
-A FORWARD -j FORWARD_OUT_ZONES_SOURCE
-A FORWARD -j FORWARD_OUT_ZONES
-A FORWARD -o br-ad8a0b610f32 -j DOCKER
-A FORWARD -o br-ad8a0b610f32 -m conntrack --ctstate RELATED,ESTABLISHED -j ACCEPT
-A FORWARD -i br-ad8a0b610f32 ! -o br-ad8a0b610f32 -j ACCEPT
-A FORWARD -i br-ad8a0b610f32 -o br-ad8a0b610f32 -j ACCEPT
-A FORWARD -o br-4811a1595aea -j DOCKER
-A FORWARD -o br-4811a1595aea -m conntrack --ctstate RELATED,ESTABLISHED -j ACCEPT
-A FORWARD -i br-4811a1595aea ! -o br-4811a1595aea -j ACCEPT
-A FORWARD -i br-4811a1595aea -o br-4811a1595aea -j ACCEPT
-A FORWARD -j LOG --log-prefix "FINAL_REJECT: "
-A OUTPUT -j OUTPUT_direct
-A DOCKER -d fd4d:6169:6c63:6f77::4/128 ! -i br-4811a1595aea -o br-4811a1595aea -p tcp -m tcp --dport 993 -j ACCEPT
-A DOCKER -d fd4d:6169:6c63:6f77::4/128 ! -i br-4811a1595aea -o br-4811a1595aea -p tcp -m tcp --dport 995 -j ACCEPT
-A DOCKER -d fd4d:6169:6c63:6f77::4/128 ! -i br-4811a1595aea -o br-4811a1595aea -p tcp -m tcp --dport 110 -j ACCEPT
-A DOCKER -d fd4d:6169:6c63:6f77::4/128 ! -i br-4811a1595aea -o br-4811a1595aea -p tcp -m tcp --dport 143 -j ACCEPT
-A DOCKER -d fd4d:6169:6c63:6f77::4/128 ! -i br-4811a1595aea -o br-4811a1595aea -p tcp -m tcp --dport 4190 -j ACCEPT
-A DOCKER -d fd4d:6169:6c63:6f77::7/128 ! -i br-4811a1595aea -o br-4811a1595aea -p tcp -m tcp --dport 25 -j ACCEPT
-A DOCKER -d fd4d:6169:6c63:6f77::7/128 ! -i br-4811a1595aea -o br-4811a1595aea -p tcp -m tcp --dport 465 -j ACCEPT
-A DOCKER -d fd4d:6169:6c63:6f77::7/128 ! -i br-4811a1595aea -o br-4811a1595aea -p tcp -m tcp --dport 587 -j ACCEPT
-A DOCKER -d fd4d:6169:6c63:6f77::a/128 ! -i br-4811a1595aea -o br-4811a1595aea -p tcp -m tcp --dport 443 -j ACCEPT
-A DOCKER -d fd4d:6169:6c63:6f77::a/128 ! -i br-4811a1595aea -o br-4811a1595aea -p tcp -m tcp --dport 80 -j ACCEPT
```

**Comment by imp1sh** [comment]
This is resolved. There was a problem not relevant to mailcow discussions.
