### ISSUE TITLE
Strange DNS requests

### ISSUE THREAD

**Issue by levinuss** [mailcow/mailcow-dockerized#1044]
Hey,
I discovered some strange DNS requests in a tcpdump today (see below). Because the the requested domain is dockerapi or redis and the DNS resolvers asked for the records are the google public dns servers (and do not use the google ones on my system) I figured the requests come from mailcow.
```
12:57:58.244804 IP6 xx:xx.56052 > google-public-dns-a.google.com.domain: 36872+ A? dockerapi. (27)
12:57:58.244865 IP6 xx:xx.56052 > google-public-dns-b.google.com.domain: 36872+ A? dockerapi. (27)
12:57:58.244913 IP6 xx:xx.56052 > google-public-dns-a.google.com.domain: 37224+ AAAA? dockerapi. (27)
12:57:58.244943 IP6 xx:xx.56052 > google-public-dns-b.google.com.domain: 37224+ AAAA? dockerapi. (27)
12:57:58.245616 IP6 google-public-dns-b.google.com.domain > xx:xx.56052: 36872 NXDomain 0/1/0 (102)
12:57:58.245634 IP6 google-public-dns-a.google.com.domain > xx:xx.56052: 36872 NXDomain 0/1/0 (102)
12:57:58.245700 IP6 google-public-dns-b.google.com.domain > xx:xx.56052: 37224 NXDomain 0/1/0 (102)
12:57:58.245713 IP6 google-public-dns-a.google.com.domain >xx:xx.56052: 37224 NXDomain 0/1/0 (102)
```
Is this mailcow? Is this the intended behavior?

**Comment by levinuss** [comment]
I did a little bit of research myself and found out that the traffic comes from the watchdog container. I looked into the resolv.conf of the watchdog container and found `127.0.0.11` and the IPv6 addresses of the google public dns. The `127.0.0.11` seemed to work, only requests over v6 (to the google DNS) failed and were repeated because they generated a `NXDomain`.
I discovered that the `watchdog-mailcow` container had no DNS servers as parameters in the `docker-compose.yml`. So I decided to add one (copied it from another container). The Google DNS servers are gone and testing with `dig redis` and `dig dockerapi` worked fine.
I wrote a little PR to add the DNS parameter against master. I hope thats okay. See  #1052

**Comment by andryyy** [comment]
It should not list Googles DNS there. 127.0.0.11 is correct for all containers as it is Dockers default DNS "proxy". It's possible you added it to your system and Docker forwards these request to the external resolver first, before falling back to the proxy. Watchdog should also not rely on Unbound.

**Comment by levinuss** [comment]
You mean docker added the default system proxy (from `/etc/resolv.conf`?) at the time of installation?/creation of the container? to the container? I don't think that thats what happened. I don't use the Google DNS (for privacy reasons) and I don't think I ever did (on this system). I have a local unbound installed to handle caching etc. Unbound is configured to use some decentral DNS servers with a no logging policy.
Is my PR helpful in that case? Isn't unbound behind the 127.0.0.11? Why has watchdog no dns servers defined in the docker-compose.yml / should not rely on the local unbound even though it queries domains for local services (`redis`/`dockerapi`)? Is there a special `/etc/hosts`?

**Comment by andryyy** [comment]
There is no Google DNS in my setups:
```
merkur:/opt/mailcow-dockerized# docker-compose exec watchdog-mailcow cat /etc/resolv.conf
nameserver 127.0.0.11
```

It is always 127.0.0.11, this is Dockers DNS proxy. No matter what is set as DNS in the yml. It always passes Dockerd. :-)

It should not rely on any container, it is a watchdog. I thought about adding a check for Unbound, but I am not even sure if we should keep Unbound in regards of swarm.

**Comment by levinuss** [comment]
Okay, strange. In this case I will close my PR and this issue. Thank you for your help.
